{
  "$schema": "https://json-schema.org/draft/2020-12/schema",
  "$id": "https://local-pii.dev/schemas/redaction/writer-receipt/1.0.0",
  "title": "Writer receipt",
  "description": "Privacy-safe record of a writer's bounded application of one immutable redaction plan to a staged artifact. Applied action IDs retain canonical redaction-plan order; paths and clear values are excluded.",
  "schemaVersion": "1.0.0",
  "type": "object",
  "additionalProperties": false,
  "required": [
    "schemaVersion",
    "planDigest",
    "writer",
    "stagedDigest",
    "stagedByteLength",
    "expectedActionCount",
    "appliedActionCount",
    "appliedActionIds",
    "receiptDigest"
  ],
  "properties": {
    "schemaVersion": { "const": "1.0.0" },
    "planDigest": { "$ref": "https://local-pii.dev/schemas/common/identifiers/1.0.0#/$defs/Digest" },
    "writer": {
      "type": "object",
      "additionalProperties": false,
      "required": ["id", "version"],
      "properties": {
        "id": { "type": "string", "pattern": "^[a-z][a-z0-9-]{2,63}$" },
        "version": { "$ref": "https://local-pii.dev/schemas/common/identifiers/1.0.0#/$defs/Semver" }
      }
    },
    "stagedDigest": { "$ref": "https://local-pii.dev/schemas/common/identifiers/1.0.0#/$defs/Digest" },
    "stagedByteLength": { "type": "integer", "minimum": 0, "maximum": 1073741824 },
    "expectedActionCount": { "type": "integer", "minimum": 0, "maximum": 100000 },
    "appliedActionCount": { "type": "integer", "minimum": 0, "maximum": 100000 },
    "appliedActionIds": {
      "type": "array",
      "maxItems": 100000,
      "uniqueItems": true,
      "items": { "type": "string", "pattern": "^act_[0-9A-HJKMNP-TV-Z]{26}$" },
      "description": "Exact action IDs in canonical immutable redaction-plan order; a writer may traverse native targets in a different safe mutation order."
    },
    "receiptDigest": { "$ref": "https://local-pii.dev/schemas/common/identifiers/1.0.0#/$defs/Digest" }
  },
  "examples": [
    {
      "schemaVersion": "1.0.0",
      "planDigest": "sha256:aaaaaaaaaaaaaaaaaaaaaaaaaaaaaaaaaaaaaaaaaaaaaaaaaaaaaaaaaaaaaaaa",
      "writer": { "id": "text-adapter", "version": "0.1.0" },
      "stagedDigest": "sha256:bbbbbbbbbbbbbbbbbbbbbbbbbbbbbbbbbbbbbbbbbbbbbbbbbbbbbbbbbbbbbbbb",
      "stagedByteLength": 38,
      "expectedActionCount": 2,
      "appliedActionCount": 2,
      "appliedActionIds": [
        "act_01J4M8Z7QK2C5B6TFXDA9R4M3V",
        "act_01J4M8Z7QK2C5B6TFXDA9R4M3W"
      ],
      "receiptDigest": "sha256:cccccccccccccccccccccccccccccccccccccccccccccccccccccccccccccccc"
    }
  ]
}
