{
  "schemaVersion": "1.0.0",
  "planDigest": "sha256:aaaaaaaaaaaaaaaaaaaaaaaaaaaaaaaaaaaaaaaaaaaaaaaaaaaaaaaaaaaaaaaa",
  "writer": {
    "id": "text-adapter",
    "version": "0.1.0"
  },
  "stagedDigest": "sha256:bbbbbbbbbbbbbbbbbbbbbbbbbbbbbbbbbbbbbbbbbbbbbbbbbbbbbbbbbbbbbbbb",
  "stagedByteLength": 38,
  "expectedActionCount": 2,
  "appliedActionCount": 2,
  "appliedActionIds": [
    "act_01J4M8Z7QK2C5B6TFXDA9R4M3V",
    "act_01J4M8Z7QK2C5B6TFXDA9R4M3W"
  ],
  "receiptDigest": "sha256:cccccccccccccccccccccccccccccccccccccccccccccccccccccccccccccccc"
}
